{
  "$schema": "https://loxtep.io/schemas/domain-package-v1.json",
  "template_type": "domain",
  "slug": "blank",
  "name": "Blank Domain",
  "description": "Create from scratch. Empty domain for custom configuration.",
  "version": "1.0.0",
  "tags": [
    "blank",
    "starter"
  ],
  "use_cases": [
    "Start from scratch",
    "Custom domain"
  ],
  "entity": {
    "domain_id": "{{DOMAIN_ID}}",
    "organization_id": "{{ORGANIZATION_ID}}",
    "name": "{{DOMAIN_NAME}}",
    "description": "",
    "owner_user_id": "{{OWNER_USER_ID}}",
    "parent_domain_id": null,
    "is_council": false,
    "metadata": {},
    "created_at": "{{CREATED_AT}}",
    "updated_at": "{{UPDATED_AT}}"
  },
  "placeholders": {
    "{{DOMAIN_ID}}": "Generated UUID for the domain",
    "{{ORGANIZATION_ID}}": "Organization that owns this domain",
    "{{DOMAIN_NAME}}": "User-provided name for the domain",
    "{{OWNER_USER_ID}}": "Domain owner user ID (optional)",
    "{{CREATED_AT}}": "ISO 8601 timestamp",
    "{{UPDATED_AT}}": "ISO 8601 timestamp"
  }
}
